{
  "schemaVersion": 1,
  "jobId": "hosted-web-contract-test",
  "workerId": "worker-1",
  "canonicalSha": "42ec333848e29e97c41699b9fed73ed199740e3f",
  "baseSha": "42ec333848e29e97c41699b9fed73ed199740e3f",
  "phaseStartSha": "$PHASE_START_SHA",
  "packetRevision": "phase-00-r2",
  "controllerPacket": "docs/hosted-web-phase-0-execution-packet.md",
  "lanePacket": "docs/hosted-web-phases/phase-00/lanes/w1-parity-renderer.md",
  "phaseId": "phase-00",
  "laneId": "w1",
  "inputPatchHash": "aaaaaaaaaaaaaaaaaaaaaaaaaaaaaaaaaaaaaaaaaaaaaaaaaaaaaaaaaaaaaaaa",
  "reviewKind": "implementation",
  "revision": 0,
  "retryCount": 0,
  "workKey": "$WORK_KEY",
  "supersedes": null,
  "registryStatus": "queued",
  "jobRoot": "$JOB_ROOT",
  "promptPath": "$JOB_ROOT/test/architecture/hosted-web/orchestration/fixtures/worker-prompt.md",
  "ownedPaths": ["docs/hosted-web-phases/START_HERE.md"],
  "mandatoryDocs": [
    "AGENTS.md",
    "CLAUDE.md",
    "AGENT_CRITICAL_GUARDRAILS.md",
    "docs/hosted-web-phases/START_HERE.md",
    "docs/hosted-web-phases/EVIDENCE_LIFECYCLE.md",
    "docs/hosted-web-phases/ORCHESTRATION_GUARDS.md",
    "docs/hosted-web-phase-0-execution-packet.md",
    "docs/hosted-web-phases/phase-00/lanes/w1-parity-renderer.md",
    "test/architecture/hosted-web/orchestration/fixtures/required-doc.md"
  ],
  "mandatoryScripts": ["test/architecture/hosted-web/orchestration/fixtures/required-script.mjs"],
  "mandatoryFixtures": ["test/architecture/hosted-web/orchestration/fixtures/input-fixture.json"],
  "requiredChecks": [
    {
      "id": "focused-contract-test",
      "cwd": "test/architecture/hosted-web/orchestration/fixtures",
      "command": "node --test ../*.test.mjs"
    }
  ],
  "executionPolicy": {
    "mode": "sandbox-only",
    "sandboxRoot": "$JOB_ROOT/test/architecture/hosted-web/orchestration/fixtures",
    "forbiddenRealProjects": ["~/dev/projects/ai/claude-runtime"]
  }
}
